{
  "schemaVersion": "1.0.0",
  "id": "magic-potion",
  "name": "Magic Potion",
  "category": "Magic",
  "tier": 3,
  "cost": {
    "total": 1500
  },
  "stats": {},
  "passives": [
    {
      "name": "Increase Power",
      "unique": true,
      "description": "Automatically used after purchasing, increases Magic Power by 30 and Cooldown Reduction by 10% for 120s. Can only have one potion effect at a time.",
      "effects": []
    }
  ],
  "sources": [
    {
      "field": "stats",
      "url": "https://mobile-legends.fandom.com/wiki/Magic_Potion",
      "retrieved": "2026-06-29"
    }
  ]
}
