{
  "schemaVersion": "1.0.0",
  "id": "war-axe",
  "name": "War Axe",
  "category": "Attack",
  "tier": 3,
  "cost": {
    "total": 2100,
    "combine": 550
  },
  "stats": {
    "physicalAttack": 35,
    "hp": 400,
    "cooldownReductionPct": 10,
    "lifestealPct": 8
  },
  "passives": [
    {
      "name": "Fighting Spirit",
      "unique": true,
      "description": "Attacks grants 12 extra Physical Attack per second for 4 seconds, up to 6 stacks. Deals 10% extra True Damage based on the damage dealt (no damage reduction counted) at full stacks. (Marksmen, Mages, and Supports only receive 50% of these stacked effects.)",
      "effects": []
    }
  ],
  "sources": [
    {
      "field": "stats",
      "url": "https://mobile-legends.fandom.com/wiki/War_Axe",
      "retrieved": "2026-06-29"
    }
  ]
}
