{
  "schemaVersion": "1.0.0",
  "id": "divine-glaive",
  "name": "Divine Glaive",
  "category": "Magic",
  "tier": 3,
  "cost": {
    "total": 1970,
    "combine": 1150
  },
  "stats": {
    "magicPower": 65
  },
  "passives": [
    {
      "name": "Unique Attribute",
      "description": "Unique Attribute: +40% Magic Penetration Unique Passive - Spellbreaker: When attacking an enemy, gains 0.1% extra Magic Penetration for each point of the enemy's Magic Defense, capped at 20%.",
      "effects": []
    }
  ],
  "sources": [
    {
      "field": "stats",
      "url": "https://mobile-legends.fandom.com/wiki/Divine_Glaive",
      "retrieved": "2026-06-29"
    }
  ]
}
